Affiliation, Title, URI
UNSW Sydney, "Tips and Guidance for Students and ECRs Writing Papers and Reports", https://gernot-heiser.org/style-guide.html
The University of Manchester, "Academic Phrasebank", https://www.phrasebank.manchester.ac.uk/
Australian National University, "Research writing", https://www.anu.edu.au/students/academic-skills/research-writing
Columbia University, "Writing Technical Articles", http://www.cs.columbia.edu/~hgs/etc/writing-style.html
Nature, "How to write a first-class paper", https://www.nature.com/articles/d41586-018-02404-4
Carnegie Mellon University, "Collected Advice on Research and Writing", http://www.cs.cmu.edu/afs/cs.cmu.edu/user/mleone/web/how-to.html
